{
  "schema_version": "redteam-candidate-v1",
  "candidate_id": "plan2-result-count-seed",
  "attack_track": "result-count-amplification",
  "model": {
    "calendars": [
      {
        "second": [
          {
            "start": 0,
            "end": 0,
            "step": 1
          }
        ],
        "minute": [
          {
            "start": 0,
            "end": 0,
            "step": 1
          }
        ],
        "hour": [
          {
            "start": 0,
            "end": 0,
            "step": 1
          }
        ],
        "day_of_month": [
          {
            "start": 2,
            "end": 2,
            "step": 1
          }
        ],
        "month": [
          {
            "start": 1,
            "end": 1,
            "step": 1
          }
        ],
        "year": [
          {
            "start": 2025,
            "end": 2025,
            "step": 1
          }
        ],
        "day_of_week": [
          {
            "start": 4,
            "end": 4,
            "step": 1
          }
        ]
      }
    ],
    "intervals": [
      {
        "interval_seconds": 1,
        "phase_seconds": 0
      }
    ],
    "exclusions": [],
    "witness": "2025-01-02T00:00:00Z",
    "start_time": null,
    "end_time": null,
    "jitter_ns": 0,
    "timezone": "UTC",
    "timezone_data": null
  },
  "query_start": "2025-01-01T00:00:00Z",
  "query_end": "2025-01-01T01:00:00Z",
  "result_limit": 1000,
  "jitter_seed": "plan2-fixed-seed",
  "representation": "structured-calendar"
}
